Serial number,Pillar,Question,Severity,Check Title,Check Description,Resource Type,Elastic Engineering Suggestions
1,costOptimization,How do you decommission resources?,Informational,Unused EBS volumes must be removed,Identifying and removing unused Amazon EBS volumes to reduce costs.,Volume,"Based on the Well-Architected Review finding, here are some potential opportunities for DevOps consultants to provide Elastic Engineering services:

1. **Automation Opportunity**: The finding suggests that there may be unused EBS volumes that need to be removed. This could lead to an opportunity for DevOps consultants to automate the process of identifying and deleting unused resources using tools like AWS CloudFormation, AWS Cloud Development Kit (CDK), or scripts.
2. **Cost Optimization Service**: As the severity level is Informational, it indicates a potential issue that can be addressed to improve cost optimization. DevOps consultants could provide services to help customers optimize their EBS volume usage and costs by identifying unused volumes and providing recommendations for cost reduction.
3. **Infrastructure-as-Code (IaC) Opportunity**: The finding highlights the importance of maintaining a clean and organized infrastructure. DevOps consultants could help customers implement IaC best practices using AWS CloudFormation or Terraform, which would enable them to manage their EBS volumes and other resources more efficiently and securely.
4. **Security Enhancement Service**: Unused EBS volumes can be a security risk if not properly deleted. DevOps consultants could provide services to ensure that unused resources are deleted in accordance with company policies and best practices, thereby enhancing overall security posture.
5. **Training and Education Opportunity**: The finding may indicate a knowledge gap within the organization regarding AWS resource management. DevOps consultants could provide training and education services to help customers understand the importance of proper resource management, including deleting unused EBS volumes.
6. **Compliance Service**: In some cases, organizations may have compliance requirements that mandate regular deletion of unused resources. DevOps consultants could help customers implement processes and tools to ensure compliance with these requirements.

These opportunities demonstrate how a Well-Architected Review finding can lead to potential Elastic Engineering services that optimize cloud infrastructure, enhance automation, reduce costs, or improve security."
2,security,How do you securely operate your workload?,Informational,Ensure AWS IAM Policies Do Not Grant Assume Role Permission,Ensure AssumeRole permissions do not grant access across all services.,IAMRole,"Based on the provided Well-Architected Review finding, here are some potential opportunities for DevOps consultants to provide Elastic Engineering services:

1. **Security Audit and Policy Optimization**: The consultant can perform a comprehensive security audit of IAM policies, focusing on ensuring that `AssumeRole` permissions do not grant access across all services. This might involve reviewing existing policies, identifying areas for improvement, and recommending updates or new policies to strengthen the overall security posture.

Opportunity: Optimize IAM policies to ensure proper isolation of resources and prevent unintended access.

2. **Resource Tagging and Organization**: The consultant can suggest implementing a consistent resource tagging strategy across the workload. This would facilitate easier identification, management, and security analysis of resources tied to specific services or departments.

Opportunity: Implement resource tagging for better organization, visibility, and compliance.

3. **Security Automation through AWS CloudFormation**: DevOps consultants can propose using AWS CloudFormation templates to create a consistent infrastructure environment with embedded security policies. This would automate the deployment process, ensuring that new resources are created with the correct IAM policies in place.

Opportunity: Automate infrastructure deployment using CloudFormation to ensure consistency and security across the workload.

4. **Cost Optimization**: The consultant can analyze the current IAM policy structure for potential over-permissioning or unnecessary access. By identifying these areas, they can recommend adjustments to minimize costs associated with resource usage and reduce waste.

Opportunity: Optimize costs by reducing unnecessary permissions and minimizing resource utilization.

5. **Monitoring and Logging Integration**: To further enhance security, the consultant might suggest integrating AWS CloudWatch monitoring and logging capabilities into the workload. This would provide real-time visibility into system activity, helping to detect potential security issues early on.

Opportunity: Integrate monitoring and logging services for enhanced threat detection and incident response.

6. **Compliance Audits**: As part of their Elastic Engineering service, DevOps consultants can perform regular compliance audits against industry standards (e.g., HIPAA, PCI-DSS). This would ensure that the workload is aligned with relevant security regulations.

Opportunity: Conduct regular compliance audits to verify adherence to industry-specific security standards.

By addressing these opportunities, DevOps consultants providing Elastic Engineering services can help optimize cloud infrastructure, enhance automation, reduce costs, and improve security for their clients."
3,sustainability,How do you take advantage of user behavior patterns to support your sustainability goals?,Low,Check for unassociated Network Interfaces,Identify and remove unassociated network interfaces to optimize resources.,NetworkInterface,"At first glance, the Well-Architected Review finding appears unrelated to sustainability goals and user behavior patterns. However, let's analyze it more deeply:

The finding is related to optimizing resources by identifying and removing unassociated network interfaces. This can lead to potential opportunities for DevOps consultants to provide Elastic Engineering services that optimize cloud infrastructure.

Here are some potential opportunities for improvement:

1.  **Optimize Network Resource Utilization**: By identifying and removing unused or unassociated network interfaces, you can reduce the number of resources being utilized by your application, leading to cost savings.
2.  **Improve Cloud Security**: Unused network interfaces can be a vulnerability in your cloud infrastructure. Removing them can improve overall security posture.
3.  **Enhance Automation**: Use automation tools to identify and remove unassociated network interfaces on an ongoing basis, reducing the need for manual intervention and improving efficiency.
4.  **Simplify Resource Management**: By removing unused resources, you can simplify resource management and reduce the likelihood of human error.

While the specific finding doesn't directly address sustainability goals or user behavior patterns, optimizing cloud infrastructure in this manner aligns with broader principles of sustainability:

*   **Reduced Costs**: Optimizing network interfaces can lead to cost savings.
*   **Improved Efficiency**: Automating resource management and removing unused resources improves overall efficiency.
*   **Enhanced Security**: Improving security posture by removing vulnerabilities contributes to a more sustainable cloud environment.

These improvements align with the spirit of sustainability, making this finding relevant to broader sustainability goals."
4,sustainability,How do you take advantage of user behavior patterns to support your sustainability goals?,Low,Unused Amazon Machine Images (AMIs) must be removed,Remove unused AMIs to avoid unnecessary costs and improve sustainability.,Image,"Based on the provided Well-Architected Review finding, I've identified potential opportunities for DevOps consultants to provide Elastic Engineering services:

1. **Cost Optimization**:
	* Opportunity: Remove unused AMIs to avoid unnecessary costs.
	* Elastic Engineering Service: Develop a script or use an existing one (e.g., AWS CloudFormation) to automate the process of deleting unused AMIs, ensuring that only necessary images are retained.
	* Automation Opportunity: Set up a scheduled task (e.g., daily or weekly) to scan for and delete unused AMIs, reducing manual effort and potential errors.
2. **Sustainability**:
	* Opportunity: Remove unused AMIs to improve sustainability.
	* Elastic Engineering Service: Implement a centralized image management system to track and manage all AMIs across the organization, making it easier to identify and remove unused ones.
	* Green IT Initiative: Integrate this process with other sustainable practices (e.g., using Spot Instances or Reserved Instances) to further reduce costs and environmental impact.
3. **Automation**:
	* Opportunity: Automate AMI management to minimize manual effort.
	* Elastic Engineering Service: Use AWS Lambda, CloudWatch Events, or other services to create a event-driven architecture that automatically removes unused AMIs based on specific criteria (e.g., age, usage patterns).
4. **Security**:
	* Opportunity: Remove unused AMIs to reduce potential security risks (e.g., outdated software vulnerabilities).
	* Elastic Engineering Service: Integrate image management with vulnerability scanning and patching services to ensure that only up-to-date images are retained.
5. **Infrastructure Optimization**:
	* Opportunity: Optimize cloud infrastructure by removing unused resources (AMIs).
	* Elastic Engineering Service: Develop a comprehensive infrastructure optimization plan, which includes the removal of unused AMIs, to improve overall resource utilization and reduce waste.

By addressing these opportunities, DevOps consultants can provide valuable Elastic Engineering services that enhance automation, reduce costs, optimize infrastructure, and improve security while supporting sustainability goals."
5,security,How do you manage permissions for people and machines?,Informational,S3 Bucket Should Not Allow List Actions,Ensure list actions are not permitted for all S3 bucket principals.,S3,"Based on the provided Well-Architected Review finding, here are some potential opportunities for DevOps consultants to provide Elastic Engineering services:

**1. Security Enhancements:**
	* Opportunity: Implement granular access controls for S3 buckets.
	* Elastic Engineering Service: Develop and deploy custom IAM policies or roles that restrict list actions on specific S3 buckets, ensuring only authorized principals can perform these actions.
	* Benefits: Improved security posture by preventing unauthorized access to bucket contents.

**2. Automation Opportunities:**
	* Opportunity: Automate S3 bucket policy updates and enforcement.
	* Elastic Engineering Service: Design and implement an automation framework using AWS Cloud Development Kit (CDK) or AWS CloudFormation that dynamically updates S3 bucket policies based on changing business requirements.
	* Benefits: Reduced manual effort, improved policy consistency, and enhanced security.

**3. Cost Optimization:**
	* Opportunity: Analyze and optimize S3 bucket storage costs.
	* Elastic Engineering Service: Conduct a detailed cost analysis of S3 bucket usage, identify areas for cost reduction (e.g., using Glacier for infrequent access data), and implement automated policies to enforce these best practices.
	* Benefits: Reduced storage costs, improved resource utilization.

**4. Improved Compliance and Governance:**
	* Opportunity: Develop a centralized compliance framework for S3 buckets.
	* Elastic Engineering Service: Design and deploy a comprehensive compliance framework that integrates with AWS Organizations, enabling central management of S3 bucket policies and access controls across multiple accounts.
	* Benefits: Enhanced governance, improved auditability, and reduced compliance risk.

These opportunities demonstrate how DevOps consultants can leverage the findings from Well-Architected Reviews to provide Elastic Engineering services that optimize cloud infrastructure, enhance automation, reduce costs, or improve security."
6,security,How do you protect your data at rest?,High,Encrypt Amazon Machine Images (AMIs),Ensure AMIs are encrypted to protect sensitive data.,Image,"Based on the Well-Architected Review finding, here are some potential opportunities for DevOps consultants to provide Elastic Engineering services:

**Optimize Cloud Infrastructure**

1. **Encryption at rest**: The consultant can suggest using Amazon S3 or other encrypted storage solutions to store AMIs and ensure that sensitive data is protected.
2. **Multi-AZ deployment**: To ensure high availability, the consultant can recommend deploying AMIs across multiple Availability Zones (AZs) to minimize the impact of a single AZ failure.

**Enhance Automation**

1. **Automated encryption**: The consultant can propose automating the encryption process for new AMIs using AWS CloudFormation or AWS CLI scripts, reducing manual effort and minimizing the risk of human error.
2. **Image tagging and versioning**: To improve image management, the consultant can suggest implementing a consistent naming convention and versioning strategy for AMIs using tags and ETags.

**Reduce Costs**

1. **Use of free-tier instances**: By storing AMIs in S3 or other encrypted storage solutions, the consultant can help reduce costs associated with storing large images on EC2 instance stores.
2. **Rightsizing EC2 instances**: If the consultant identifies that EC2 instances are running with less capacity than required, they can recommend rightsizing instances to smaller types, reducing unused capacity and costs.

**Improve Security**

1. **Regular rotation of encryption keys**: The consultant can suggest implementing a regular key rotation policy for AMIs to ensure that encryption keys are updated periodically, minimizing the risk of compromised keys.
2. **Monitoring and alerting**: To detect potential security issues, the consultant can propose setting up monitoring and alerting mechanisms to notify administrators in case of encryption key expiration or other related security events.

By addressing these opportunities, DevOps consultants can provide valuable Elastic Engineering services that optimize cloud infrastructure, enhance automation, reduce costs, and improve security for their clients."
7,security,How do you protect your compute resources?,Medium,EC2 IMDSv2 enabled,Ensure IMDSv2 is enabled for enhanced EC2 instance security.,Instance,"Based on the Well-Architected Review finding, here are some potential opportunities for DevOps consultants to provide Elastic Engineering services:

1. **Optimize Cloud Infrastructure**:
	* Review EC2 instance configurations and suggest enabling IMDSv2 by default for new instances.
	* Provide guidance on optimizing instance types and sizes based on actual usage patterns.
	* Recommend using Amazon EBS volumes with encryption enabled to further enhance security.
2. **Enhance Automation**:
	* Develop a script or CloudFormation template to automate the process of enabling IMDSv2 across all EC2 instances.
	* Integrate the automation with existing infrastructure as code (IaC) tools, such as AWS CloudFormation or Terraform.
	* Suggest using AWS Systems Manager (SSM) to centralize and standardize configuration management.
3. **Reduce Costs**:
	* Identify opportunities to right-size EC2 instances based on actual usage patterns, reducing waste and cost.
	* Recommend using spot instances for non-production workloads or when burst capacity is needed.
	* Provide guidance on using Amazon EBS snapshots to reduce storage costs.
4. **Improve Security**:
	* Conduct a deeper security analysis of the environment to identify potential vulnerabilities and provide recommendations for improvement.
	* Develop a plan to implement additional security controls, such as AWS IAM roles with least privilege access, network ACLs (NACLs), or security groups.

Some specific Elastic Engineering services that could be offered include:

1. **Instance Configuration Optimization**: Review EC2 instance configurations to ensure they are optimized for performance and cost.
2. **IMDSv2 Enablement Scripting**: Develop a script or CloudFormation template to automate the process of enabling IMDSv2 across all EC2 instances.
3. **Security Control Assessment**: Conduct a security control assessment to identify potential vulnerabilities and provide recommendations for improvement.
4. **Cloud Infrastructure Optimization**: Review and optimize cloud infrastructure, including instance types, sizes, and EBS volumes, to ensure alignment with business needs.

These opportunities can help the organization optimize its cloud infrastructure, enhance automation, reduce costs, and improve security, ultimately leading to a more well-architected environment."
8,performance,How do you select the best performing architecture?,Low,Ensure Provisioned IOPS volumes are attached,Provisioned IOPS volumes must be attached to optimize performance.,Volume,"Based on the provided Well-Architected Review finding, here are some potential opportunities for DevOps consultants to provide Elastic Engineering services:

1. **Cost Optimization**: While the severity of this finding is Low, it indicates a missed opportunity to optimize performance by not attaching Provisioned IOPS volumes. A DevOps consultant could analyze storage usage and suggest upgrading to Provisioned IOPS volumes where necessary, potentially reducing costs by avoiding overprovisioning or underutilization.
2. **Automation Opportunities**: To ensure that Provisioned IOPS volumes are consistently attached, a DevOps consultant could propose automating this process through scripts or infrastructure as code (IaC) tools like Terraform or CloudFormation. This would improve consistency and reduce manual errors.
3. **Infrastructure Optimization**: A DevOps consultant could perform an analysis to determine if the existing storage configuration is optimized for performance. They might recommend adjusting instance types, considering new storage options (e.g., SSDs), or even migrating workloads to more suitable services based on their performance characteristics.
4. **Security Review**: While not directly related to security, ensuring that Provisioned IOPS volumes are attached correctly could have implications for data protection and recovery if not properly configured. A DevOps consultant might also use this as an opportunity to review backup and disaster recovery strategies in place.
5. **Elastic Engineering: Performance Tiers**: In more complex scenarios, a DevOps consultant could analyze the performance requirements of different workloads and suggest implementing tiered storage based on their needs. This involves categorizing applications into hot (frequently accessed), warm, or cold data tiers, each with optimized storage solutions to meet their unique performance demands.
6. **Resource Tagging and Visibility**: Implementing consistent tagging across resources can help track costs and identify opportunities for optimization. A DevOps consultant could suggest implementing tags on volumes, instances, and other resources for better visibility into usage patterns and resource allocation.

These potential areas of focus demonstrate how a Well-Architected Review finding can serve as an entry point for Elastic Engineering services that go beyond just fixing the initial issue, potentially improving cloud infrastructure, automation, costs, or security across the organization."
9,security,How do you protect your data at rest?,High,Encrypt Amazon Machine Images (AMIs),Ensure Amazon Machine Images are encrypted for data protection.,Image,"Based on the Well-Architected Review finding, here are some potential opportunities for DevOps consultants to provide Elastic Engineering services:

**Optimize Cloud Infrastructure**

1. **Encryption at rest**: The consultant can suggest using Amazon S3 or other encrypted storage solutions to store AMIs and ensure that sensitive data is protected.
2. **Multi-AZ deployment**: To ensure high availability, the consultant can recommend deploying AMIs across multiple Availability Zones (AZs) to minimize the impact of a single AZ failure.

**Enhance Automation**

1. **Automated encryption**: The consultant can propose automating the encryption process for new AMIs using AWS CloudFormation or AWS CLI scripts, reducing manual effort and minimizing the risk of human error.
2. **Image tagging and versioning**: To improve image management, the consultant can suggest implementing a consistent naming convention and versioning strategy for AMIs using tags and ETags.

**Reduce Costs**

1. **Use of free-tier instances**: By storing AMIs in S3 or other encrypted storage solutions, the consultant can help reduce costs associated with storing large images on EC2 instance stores.
2. **Rightsizing EC2 instances**: If the consultant identifies that EC2 instances are running with less capacity than required, they can recommend rightsizing instances to smaller types, reducing unused capacity and costs.

**Improve Security**

1. **Regular rotation of encryption keys**: The consultant can suggest implementing a regular key rotation policy for AMIs to ensure that encryption keys are updated periodically, minimizing the risk of compromised keys.
2. **Monitoring and alerting**: To detect potential security issues, the consultant can propose setting up monitoring and alerting mechanisms to notify administrators in case of encryption key expiration or other related security events.

By addressing these opportunities, DevOps consultants can provide valuable Elastic Engineering services that optimize cloud infrastructure, enhance automation, reduce costs, and improve security for their clients."
10,costOptimization,How do you decommission resources?,Informational,Unused EBS volumes must be removed,Remove unused EBS volumes to avoid additional costs.,Volume,"Based on the Well-Architected Review finding, here are some potential opportunities for DevOps consultants to provide Elastic Engineering services:

1. **Automation Opportunity**: The finding suggests that there may be unused EBS volumes that need to be removed. This could lead to an opportunity for DevOps consultants to automate the process of identifying and deleting unused resources using tools like AWS CloudFormation, AWS Cloud Development Kit (CDK), or scripts.
2. **Cost Optimization Service**: As the severity level is Informational, it indicates a potential issue that can be addressed to improve cost optimization. DevOps consultants could provide services to help customers optimize their EBS volume usage and costs by identifying unused volumes and providing recommendations for cost reduction.
3. **Infrastructure-as-Code (IaC) Opportunity**: The finding highlights the importance of maintaining a clean and organized infrastructure. DevOps consultants could help customers implement IaC best practices using AWS CloudFormation or Terraform, which would enable them to manage their EBS volumes and other resources more efficiently and securely.
4. **Security Enhancement Service**: Unused EBS volumes can be a security risk if not properly deleted. DevOps consultants could provide services to ensure that unused resources are deleted in accordance with company policies and best practices, thereby enhancing overall security posture.
5. **Training and Education Opportunity**: The finding may indicate a knowledge gap within the organization regarding AWS resource management. DevOps consultants could provide training and education services to help customers understand the importance of proper resource management, including deleting unused EBS volumes.
6. **Compliance Service**: In some cases, organizations may have compliance requirements that mandate regular deletion of unused resources. DevOps consultants could help customers implement processes and tools to ensure compliance with these requirements.

These opportunities demonstrate how a Well-Architected Review finding can lead to potential Elastic Engineering services that optimize cloud infrastructure, enhance automation, reduce costs, or improve security."
